{
  "$schema": "https://json-schema.org/draft/2020-12/schema",
  "$id": "https://github.com/ZeroSOC/zerosoc-skills/capabilities/zerosoc.capabilities.schema.json",
  "title": "ZeroSOC capability binding",
  "type": "object",
  "required": [
    "capabilities",
    "data_sources"
  ],
  "properties": {
    "deployment": {
      "type": "string",
      "description": "Free-text label of the deployment this binding describes."
    },
    "reference": {
      "type": "object",
      "required": [
        "manifest",
        "provides"
      ],
      "description": "For a binding shipped as a reference shape: what it was derived from, so tools/check_binding.py can derive it again and report any difference. manifest is the URL of the server's capabilities manifest at a commit, release names the tag that commit carries, and provides lists every requirement the deployment meets (api:..., hunting:<table>, role:...), in the manifest's own terms; an always: requirement holds everywhere and is not listed. A binding a probe wrote from a live tenant carries none.",
      "properties": {
        "manifest": {
          "type": "string"
        },
        "provides": {
          "type": "array",
          "items": {
            "type": "string"
          }
        },
        "release": {
          "type": "string"
        }
      }
    },
    "capabilities": {
      "type": "object",
      "description": "capability class -> the provider that serves it, or an ordered list of providers. Several providers of one class each answer for the observables they accept, and each answer is its own observation, naming its source.",
      "additionalProperties": {
        "oneOf": [
          {
            "$ref": "#/$defs/provider"
          },
          {
            "title": "providers",
            "type": "array",
            "minItems": 1,
            "items": {
              "$ref": "#/$defs/listed_provider"
            }
          }
        ]
      }
    },
    "data_sources": {
      "type": "object",
      "description": "required_data_sources name (as written in playbook frontmatter) -> available to the executor",
      "additionalProperties": {
        "type": "boolean"
      }
    },
    "data_source_notes": {
      "type": "object",
      "description": "required_data_sources name -> why it is unavailable or limited; printed with the visibility gap",
      "additionalProperties": {
        "type": "string"
      }
    },
    "source_profiles": {
      "type": "object",
      "description": "source identifier -> the source profile of that technology, named from the tool skill that holds it (\"<tool skill>/source_profile.json\"). It is looked for beside the binding file first, where a deployment's own copy wins, and then beside the installed skills. A profile says what the source's records mean in the framework's terms; it is validated against source_profile.schema.json. A deployment that names none has no profile, which is a visibility gap and not an error.",
      "additionalProperties": {
        "type": "string"
      }
    },
    "source_profile_overrides": {
      "type": "object",
      "description": "source identifier -> a local override laid over that source's profile (a path next to the binding file), validated against source_profile_override.schema.json. The shipped profile is the default and a deployment normally names none: an override unblocks a tenant when the source changes a field or a word before the shipped profile follows, holds only what differs, and is recorded on the ledger and in the Case's provenance of every run read through it.",
      "additionalProperties": {
        "type": "string"
      }
    }
  },
  "$defs": {
    "provider": {
      "title": "provider",
      "type": "object",
      "required": [
        "tool"
      ],
      "properties": {
        "tool": {
          "type": "string",
          "description": "What the host invokes: an MCP server/tool, a CLI, an endpoint."
        },
        "notes": {
          "type": "string"
        },
        "accepts": {
          "type": "array",
          "minItems": 1,
          "items": {
            "enum": [
              "ip",
              "domain",
              "url",
              "hash"
            ]
          },
          "description": "The observable kinds this provider is asked about. Absent on a single provider: every kind the class takes."
        },
        "egress": {
          "enum": [
            "tenant",
            "third-party"
          ],
          "description": "tenant: the organisation's own system of record, asked about anything. third-party: anything else, asked only about external indicators, as bare values (the framework's egress rule). A host treats a provider that says neither as third-party."
        }
      }
    },
    "listed_provider": {
      "title": "listed provider",
      "type": "object",
      "required": [
        "tool",
        "accepts"
      ],
      "properties": {
        "tool": {
          "type": "string",
          "description": "What the host invokes: an MCP server/tool, a CLI, an endpoint."
        },
        "notes": {
          "type": "string"
        },
        "accepts": {
          "type": "array",
          "minItems": 1,
          "items": {
            "enum": [
              "ip",
              "domain",
              "url",
              "hash"
            ]
          },
          "description": "The observable kinds this provider is asked about. Absent on a single provider: every kind the class takes."
        },
        "egress": {
          "enum": [
            "tenant",
            "third-party"
          ],
          "description": "tenant: the organisation's own system of record, asked about anything. third-party: anything else, asked only about external indicators, as bare values (the framework's egress rule). A host treats a provider that says neither as third-party."
        }
      },
      "description": "One of several providers of a class: it says which observables it takes."
    }
  }
}
