{
  "deployment": "reference shape: Microsoft 365 Business Premium tenant (Defender for Business, Defender for Office 365 Plan 1, Entra ID P1) reached through the microsoft-security MCP server; advanced hunting answers the identity and vulnerability tables, while the raw endpoint, email and cloud-app activity tables stay empty at this licence. It is what the server's capability probe binds on a tenant meeting reference.provides, which tools/check_binding.py verifies against the manifest; a probe run against the tenant itself supersedes this file.",
  "reference": {
    "manifest": "https://raw.githubusercontent.com/ZeroSOC/zerosoc-mcp/248231a72744372109063b7cdbf7437341c8901c/servers/microsoft-security/capabilities.manifest.json",
    "provides": [
      "api:graph.alerts",
      "api:graph.incidents",
      "api:graph.directory_audits",
      "api:graph.sign_ins",
      "api:mde.machines",
      "api:mde.software",
      "hunting:IdentityInfo",
      "role:graph/SecurityIncident.ReadWrite.All",
      "role:mde/File.Read.All",
      "role:mde/Machine.Isolate",
      "role:mde/Machine.StopAndQuarantine",
      "role:mde/Ti.ReadWrite.All"
    ],
    "release": "microsoft-security-v0.5.1"
  },
  "capabilities": {
    "asset.cmdb": {
      "tool": "mcp:defender-xdr/defender_get_machine_by_id",
      "notes": "device role, OS, exposure and tags (defender_get_software for the software inventory); business criticality comes from the SOC Knowledge Base"
    },
    "identity.directory": {
      "tool": "mcp:defender-xdr/defender_run_hunting_query",
      "notes": "the IdentityInfo table: department, title, group membership, assigned roles"
    },
    "soc.knowledge_base": {
      "tool": "file:./soc-kb/"
    },
    "cases.store": {
      "tool": "mcp:defender-xdr/defender_list_incidents",
      "notes": "closed incidents and their entities; the 90-day retrospective sweep runs here, never through telemetry"
    },
    "malware.repository": {
      "tool": "mcp:defender-xdr/defender_get_file_info",
      "notes": "prevalence and first-seen by hash; hashes only leave the environment"
    },
    "decode": {
      "tool": "mcp:defender-xdr/defender_decode_command",
      "notes": "encoded PowerShell commands; timestamp_to_utc for time zones"
    },
    "telemetry.endpoint": {
      "tool": "mcp:defender-xdr/defender_get_incident_evidence",
      "notes": "alert evidence only: there is no query language to translate playbook questions into; every question the evidence does not answer is a visibility gap"
    },
    "telemetry.identity": {
      "tool": "mcp:defender-xdr/entra_list_sign_ins",
      "notes": "sign-in log (list_directory_audits for directory changes)"
    },
    "containment.isolate_host": {
      "tool": "mcp:defender-xdr/defender_isolate_machine",
      "notes": "reversed by defender_unisolate_machine"
    },
    "containment.quarantine_file": {
      "tool": "mcp:defender-xdr/defender_stop_and_quarantine_file"
    },
    "containment.block_indicator": {
      "tool": "mcp:defender-xdr/defender_create_indicator",
      "notes": "reversed by defender_delete_indicator"
    },
    "ticketing": {
      "tool": "mcp:defender-xdr/defender_add_incident_comment",
      "notes": "tuning tickets as incident comments until a ticketing tool is bound"
    }
  },
  "data_sources": {
    "AD/GPO & deployment-infrastructure logs": false,
    "API gateway logs": false,
    "Anti-virus / anti-malware": true,
    "Application & API gateway logs": false,
    "Application / API logs": false,
    "Application logs": false,
    "Backup system logs": false,
    "Backup-system logs": false,
    "CASB": false,
    "CASB / SaaS discovery": false,
    "CASB / access-policy evaluation logs": false,
    "CASB / access-policy logs": false,
    "CDN / WAF logs": false,
    "Change / maintenance schedule": false,
    "Cloud & remote-access audit for vendor/MSP accounts": false,
    "Cloud Security Posture Management (CSPM)": false,
    "Cloud audit + billing/cost telemetry": false,
    "Cloud billing / cost telemetry": false,
    "Cloud control-plane audit logs": false,
    "Cloud-storage audit logs": false,
    "Compute/GPU utilization metrics": false,
    "Configuration-management / backup diffs": false,
    "Container / Kubernetes logs": false,
    "Control-network flows": false,
    "DLP": false,
    "DLP / file-access audit logs": false,
    "DNS logs": false,
    "Data Loss Prevention (DLP)": false,
    "Data classification labels": false,
    "Database audit logs": false,
    "Directory / identity-provider audit logs": true,
    "Directory audit logs": true,
    "EDR": false,
    "EDR / endpoint process telemetry": false,
    "EDR on web servers": false,
    "Email detonation / sandbox": false,
    "Email gateway / attachment sandbox logs": false,
    "Email gateway / sandbox": false,
    "Email gateway / secure email gateway": false,
    "Email gateway logs": false,
    "Endpoint telemetry": false,
    "Engineering-workstation / HMI endpoint telemetry": false,
    "File / object access audit logs": false,
    "File audit + classification labels": false,
    "File system / storage audit logs": false,
    "File-integrity monitoring": false,
    "Firewall logs": false,
    "GPU / compute telemetry": false,
    "HR context (joiner-mover-leaver)": false,
    "Host-application logs for AI features": false,
    "Hypervisor management-plane audit logs": false,
    "Identity Provider / directory audit logs": true,
    "Identity provider sign-in logs": true,
    "LLM / inference API logs (prompts + completions)": false,
    "MFA logs": true,
    "Mailbox audit logs": false,
    "Mailbox audit logs (pivot)": false,
    "Model registry & ML-pipeline audit logs": false,
    "Model-API usage logs": false,
    "Netflow": false,
    "Netflow (mining-pool destinations)": false,
    "Netflow / DDoS appliance telemetry": false,
    "Netflow / proxy / CASB egress logs": false,
    "Netflow to/from the device": false,
    "Network / CASB / firewall logs": false,
    "Network flow / NDR": false,
    "Network-device AAA / admin logs": false,
    "OT / ICS intrusion detection (IDS)": false,
    "OT IDS": false,
    "Process historian": false,
    "Proxy / DNS / firewall egress logs": false,
    "Proxy / DNS logs": false,
    "Proxy / web gateway logs": false,
    "Server EDR": false,
    "Software inventory / SBOM": true,
    "Storage / hypervisor audit logs": false,
    "Threat-intel / reputation enrichment (hash, IP, domain)": true,
    "Training-data lineage": false,
    "Update-infrastructure logs": false,
    "Upstream ISP / scrubbing-provider telemetry": false,
    "User-reported phishing mailbox": true,
    "VPN logs": false,
    "Vendor advisories / threat intelligence": false,
    "WAF logs": false,
    "Web Application Firewall (WAF)": false
  },
  "data_source_notes": {
    "Anti-virus / anti-malware": "antivirus detections arrive as alerts; antivirus health through the device health operations",
    "EDR": "no raw process telemetry at this licence level (the Device* hunting tables stay empty); the process, file, registry and network entities cited by the alerts are available as alert evidence",
    "EDR / endpoint process telemetry": "no raw process telemetry at this licence level (the Device* hunting tables stay empty); the process, file, registry and network entities cited by the alerts are available as alert evidence",
    "EDR on web servers": "no raw process telemetry at this licence level (the Device* hunting tables stay empty); the process, file, registry and network entities cited by the alerts are available as alert evidence",
    "Email detonation / sandbox": "no analyzed-email data (message events, detonation results) at this licence level; alert-policy alerts such as the user-report alert still arrive as alerts",
    "Email gateway / attachment sandbox logs": "no analyzed-email data (message events, detonation results) at this licence level; alert-policy alerts such as the user-report alert still arrive as alerts",
    "Email gateway / sandbox": "no analyzed-email data (message events, detonation results) at this licence level; alert-policy alerts such as the user-report alert still arrive as alerts",
    "Email gateway / secure email gateway": "no analyzed-email data (message events, detonation results) at this licence level; alert-policy alerts such as the user-report alert still arrive as alerts",
    "Email gateway logs": "no analyzed-email data (message events, detonation results) at this licence level; alert-policy alerts such as the user-report alert still arrive as alerts",
    "Endpoint telemetry": "no raw process telemetry at this licence level (the Device* hunting tables stay empty); the process, file, registry and network entities cited by the alerts are available as alert evidence",
    "Engineering-workstation / HMI endpoint telemetry": "no raw process telemetry at this licence level (the Device* hunting tables stay empty); the process, file, registry and network entities cited by the alerts are available as alert evidence",
    "MFA logs": "authentication details of the sign-in log",
    "Mailbox audit logs": "the mailbox audit trail reaches the server through the cloud-apps hunting table, which this licence does not populate; current inbox rules are readable as state through the mail API",
    "Mailbox audit logs (pivot)": "the mailbox audit trail reaches the server through the cloud-apps hunting table, which this licence does not populate; current inbox rules are readable as state through the mail API",
    "Server EDR": "no raw process telemetry at this licence level (the Device* hunting tables stay empty); the process, file, registry and network entities cited by the alerts are available as alert evidence",
    "Software inventory / SBOM": "endpoint software inventory from vulnerability management; no SBOM",